{
  "schema_version": "1.0",
  "grid": { "rows": 3, "cols": 3, "cell_id_range": [1, 9] },
  "items": [
    { "cell_id": 1, "product": "Bánh quy bơ",      "pick": true  },
    { "cell_id": 2, "product": "Sữa tươi 1L",      "pick": false },
    { "cell_id": 3, "product": "Mì gói",           "pick": true  },
    { "cell_id": 4, "product": "Nước suối 500ml",  "pick": false },
    { "cell_id": 5, "product": "Trà xanh",         "pick": true  },
    { "cell_id": 6, "product": "Kẹo bạc hà",       "pick": false },
    { "cell_id": 7, "product": "Cà phê lon",       "pick": true  },
    { "cell_id": 8, "product": "Snack khoai tây",  "pick": false },
    { "cell_id": 9, "product": "Nước ngọt cola",   "pick": true  }
  ],
  "selection_source": {
    "mode": "mixed",
    "web_tick": true,
    "voice_llm": true
  }
}
